Title,Link,Date
Trump slaps 50% tariffs on Canada and Carney vows to 'intensify' trade talks,https://www.bbc.com/news/articles/cg4dzq3x3e1o,No Date
"US launches fresh strikes on Iran, as Trump warns of retaliation for deaths of soldiers",https://www.bbc.com/news/articles/cx25wg2x26do,No Date
Nineteen found guilty of trafficking babies in Indonesia and Singapore,https://www.bbc.com/news/live/c330d4ee4znt,No Date
US shoppers react to mysterious ‘explosive diarrhoea’ parasite,https://www.bbc.com/news/videos/c4g3p74rr6lo,No Date
Trump and Burnham: Can the two leaders work together?,https://www.bbc.com/news/videos/cqx78j77ej2o,No Date
Burnham to remove VAT from household electricity bills in first major policy announcement as PM,https://www.bbc.com/news/live/cgrkv8e8l9qt,No Date
Fifa opens investigation into Argentina post-final trouble,https://www.bbc.com/sport/football/articles/clyxjk0z5y7o,No Date
The 20-somethings betting big on tech stocks,https://www.bbc.com/news/articles/c20yz9v1llro,No Date
'If only people knew what a tick could do' - the deadly meat allergy caused by tick bites,https://www.bbc.com/news/articles/cj6g03567edo,No Date
Video appears to show confrontation between Chinese and Philippine navy vessels,https://www.bbc.com/news/videos/c9w0l50wegzo,No Date
Watch: Spain World Cup champions receive royal welcome in Madrid,https://www.bbc.com/news/videos/c78g69nddgeo,No Date
Tate brothers appear in US court for extradition proceedings,https://www.bbc.com/news/articles/c6294y87wk6o,No Date
"'Anti-ICE' Army veteran set fire outside Manhattan federal building, say officials",https://www.bbc.com/news/articles/c1m1rr90dzxo,No Date
UK's next prime minister,No Link,No Date
Chris Mason: Cull of Starmer allies as new chancellor faces crunching spending choices,https://www.bbc.com/news/articles/c24mnnnd18do,No Date
Who's in Andy Burnham's cabinet?,https://www.bbc.com/news/articles/ckg4we9g58do,No Date
Why Andy Burnham will find it so tricky to unite Britain,https://www.bbc.com/news/articles/c17y7r9yv1ro,No Date
More to explore,No Link,No Date
Will the Tate brothers be extradited from the US to the UK?,https://www.bbc.com/news/articles/cjej0j0lzkno,No Date
"In pictures: World Cup moments that stunned, shocked and melted hearts",https://www.bbc.co.uk/news/resources/idt-59f97f17-4336-44e6-9cd5-b320e12c3d97,No Date
‘All I think about is her’: Families demand answers as Nigeria's boat disasters keep happening,https://www.bbc.com/news/articles/c309vzn676go,No Date
"'I made £100,000 of TikTok sales in one day': The business of live shopping",https://www.bbc.com/news/articles/cm2j22w8k0po,No Date
Could Infantino really push through a 64-team World Cup?,https://www.bbc.com/sport/football/articles/cly7ley50g9o,No Date
Kevin Keegan: From superstar footballer to elite manager,https://www.bbc.com/sport/football/articles/c20z4d87vp3o,No Date
My fitness tracker knew I was pregnant before I did,https://www.bbc.com/news/articles/cr474z1qyn6o,No Date
Why are thousands of people protesting in Delhi?,https://www.bbc.com/news/articles/cedj9j911p8o,No Date
Most watched,No Link,No Date
Misleading posts about Trump at World Cup final viewed by millions,https://www.bbc.com/news/videos/cn5n4rxyz3wo,No Date
BBC reveals official report into deadly military jet crash at school,https://www.bbc.com/news/videos/c0l5gg5ye5ro,No Date
This picture of baby Haaland with Ronaldo is fake,https://www.bbc.com/news/videos/cn4r9771lnpo,No Date
Also in news,No Link,No Date
Tropical Storm Bertha threatens US Gulf coast,https://www.bbc.com/news/articles/cqjxzzdrl4lo,No Date
Ten killed as Russian attacks on merchant ships in Black Sea intensify,https://www.bbc.com/news/articles/c4gvpv3ewv2o,No Date
At least 20 dead and more than 100 missing in Afghan floods,https://www.bbc.com/news/articles/cj03rr03008o,No Date
At least 27 dead and 83 missing after passenger ferry capsizes off Guyana,https://www.bbc.com/news/articles/cm2gm99nrm7o,No Date
Notorious drug cartel leader Ismael Zambada sentenced to life in US prison,https://www.bbc.com/news/articles/ce3q1d1ed5do,No Date
Merger deal between Paramount and Warner Bros paused by judge,https://www.bbc.com/news/articles/c5ywxy41vg6o,No Date
Most read,No Link,No Date
Warning to parents after unsafe squishy toys seized,https://www.bbc.com/news/articles/cn9nx4rx0eno,No Date
Russian warship carried out firing exercise off Plymouth coast,https://www.bbc.com/news/articles/ce970jryrk3o,No Date
Rare identical quadruplets born in Australia,https://www.bbc.com/news/articles/cx2jnj3428lo,No Date
"Boy, 13, one of Scotland's first to undergo innovative brain surgery",https://www.bbc.com/news/articles/clyvg7v60pno,No Date
Sport,No Link,No Date
Fifa opens investigation into Argentina post-final trouble - what happens next?,https://www.bbc.com/sport/football/articles/clyxjk0z5y7o,No Date
"Gifted, charismatic and passionate amid highs and lows - Keegan obituary",https://www.bbc.com/sport/football/articles/c20z4d87vp3o,No Date
Rodri's stock at all-time high as he adds to trophy collection,https://www.bbc.com/sport/football/articles/cj03j6yzq20o,No Date
Cricket quiz: Can you name all eight teams in The Hundred?,https://www.bbc.com/sport/cricket/articles/c93457zxnk5o,No Date
Gallery: Spain celebrate World Cup triumph in Madrid,https://www.bbc.com/sport/football/articles/cgje79d6q64o,No Date
Guardiola in reported talks with Italy - would England come calling?,https://www.bbc.com/sport/football/articles/c20dn5j0lj0o,No Date
Fake kits worth £18m seized by police during World Cup,https://www.bbc.com/sport/football/articles/c0rdgrkx552o,No Date
